{
  "schema_version": 1,
  "dataset_id": "communicative_function_progression_strands",
  "version": 1,
  "level_order": [
    "pre_a1",
    "a1",
    "a2",
    "b1",
    "b2",
    "c1",
    "c2"
  ],
  "lifecycle_order": [
    "expose",
    "introduce",
    "practise",
    "recycle",
    "consolidate",
    "extend"
  ],
  "inputs": [
    {
      "path": "data/reviewed/communicative-tag-assignments-v1.json",
      "sha256": "afe54f8f9314e4167d8f94cf9e80baa9db6da6150fb3692c5e010989e10e98ff"
    },
    {
      "path": "data/reviewed/level-exit-profiles-v1.json",
      "sha256": "8cd53270688f6aafadddb7beb7f8f3717d832a464f127fefd3def3a1a62da30a"
    }
  ],
  "strands": [
    {
      "strand_id": "function.advise_or_recommend",
      "function_code": "advise_or_recommend",
      "title": "Advise Or Recommend",
      "curriculum_intent": "Give or seek advice and recommend a course of action.",
      "strand_role": "communicative",
      "evidence": {
        "assignment_count": 16,
        "assignment_ids_sha256": "9249b9b8515406554843b1c9624c88eaab42cfd1620971d10accac612e2ba32a",
        "representative_assignment_ids": [
          "cefr_all_descriptors:cefr.cv2020.p063.b2.sustained_monologue_giving_information.001",
          "cefr_all_descriptors:cefr.cv2020.p092.a2.overall_mediation.001",
          "gse_all_objectives:gse.adult.2022.b2_plus.p43.016"
        ],
        "source_levels": [
          "a2",
          "b1",
          "b2",
          "c1"
        ],
        "source_datasets": [
          "cefr_all_descriptors",
          "gse_all_objectives"
        ]
      },
      "lifecycle": {
        "first_exposure_level": "a2",
        "first_receptive_control_level": null,
        "first_productive_control_level": "a2",
        "consolidation_level": "a2",
        "recycle_levels": [
          "b1",
          "b2",
          "c1",
          "c2"
        ],
        "extension_levels": [
          "b1",
          "b2",
          "c1"
        ],
        "within_level_order_required": true,
        "stages": [
          {
            "level": "a2",
            "evidence_count": 5,
            "evidence_status": "source_evidenced",
            "control_expectation": "productive",
            "lifecycle_states": [
              "expose",
              "introduce",
              "practise",
              "consolidate"
            ]
          },
          {
            "level": "b1",
            "evidence_count": 4,
            "evidence_status": "source_evidenced",
            "control_expectation": "productive",
            "lifecycle_states": [
              "recycle",
              "extend"
            ]
          },
          {
            "level": "b2",
            "evidence_count": 6,
            "evidence_status": "source_evidenced",
            "control_expectation": "productive",
            "lifecycle_states": [
              "recycle",
              "extend"
            ]
          },
          {
            "level": "c1",
            "evidence_count": 1,
            "evidence_status": "source_evidenced",
            "control_expectation": "productive",
            "lifecycle_states": [
              "recycle",
              "extend"
            ]
          },
          {
            "level": "c2",
            "evidence_count": 0,
            "evidence_status": "planned_recycle",
            "control_expectation": "productive",
            "lifecycle_states": [
              "recycle"
            ]
          }
        ],
        "rationale": "Published level evidence sets the first control boundary; earlier Pre-A1 evidence remains support. The function is deliberately recycled at every later exit level, while extension is source-evidenced."
      },
      "review": {
        "status": "accepted",
        "review_basis": "source_level_boundary_plus_persistence_policy"
      }
    },
    {
      "strand_id": "function.analyze_or_criticize",
      "function_code": "analyze_or_criticize",
      "title": "Analyze Or Criticize",
      "curriculum_intent": "Analyse evidence or a text and produce reasoned criticism.",
      "strand_role": "communicative",
      "evidence": {
        "assignment_count": 13,
        "assignment_ids_sha256": "9aff052d2ce45db11ec736798cb8790c7b09a780e4b46b68b7112fa30f566949",
        "representative_assignment_ids": [
          "cefr_all_descriptors:cefr.cv2020.p067.c1.creative_writing.003",
          "cefr_all_descriptors:cefr.cv2020.p107.c1.analysis_and_criticism_of_creative_texts_including.001",
          "gse_all_objectives:gse.adult.2022.c2.p36.006"
        ],
        "source_levels": [
          "b2",
          "c1",
          "c2"
        ],
        "source_datasets": [
          "cefr_all_descriptors",
          "gse_all_objectives"
        ]
      },
      "lifecycle": {
        "first_exposure_level": "b2",
        "first_receptive_control_level": null,
        "first_productive_control_level": "b2",
        "consolidation_level": "b2",
        "recycle_levels": [
          "c1",
          "c2"
        ],
        "extension_levels": [
          "c1",
          "c2"
        ],
        "within_level_order_required": true,
        "stages": [
          {
            "level": "b2",
            "evidence_count": 1,
            "evidence_status": "source_evidenced",
            "control_expectation": "productive",
            "lifecycle_states": [
              "expose",
              "introduce",
              "practise",
              "consolidate"
            ]
          },
          {
            "level": "c1",
            "evidence_count": 5,
            "evidence_status": "source_evidenced",
            "control_expectation": "productive",
            "lifecycle_states": [
              "recycle",
              "extend"
            ]
          },
          {
            "level": "c2",
            "evidence_count": 7,
            "evidence_status": "source_evidenced",
            "control_expectation": "productive",
            "lifecycle_states": [
              "recycle",
              "extend"
            ]
          }
        ],
        "rationale": "Published level evidence sets the first control boundary; earlier Pre-A1 evidence remains support. The function is deliberately recycled at every later exit level, while extension is source-evidenced."
      },
      "review": {
        "status": "accepted",
        "review_basis": "source_level_boundary_plus_persistence_policy"
      }
    },
    {
      "strand_id": "function.ask_for_information",
      "function_code": "ask_for_information",
      "title": "Ask For Information",
      "curriculum_intent": "Request a specific fact, confirmation, or explanation.",
      "strand_role": "communicative",
      "evidence": {
        "assignment_count": 10,
        "assignment_ids_sha256": "bdb28b6a12014052a108472335c3b92ee9990cf33a6d0336f673d939a1bf5bbb",
        "representative_assignment_ids": [
          "gse_all_objectives:gse.adult.2022.a1.p22.026",
          "gse_all_objectives:gse.adult.2022.a2.p24.016",
          "gse_all_objectives:gse.adult.2022.b2_plus.p43.007"
        ],
        "source_levels": [
          "a1",
          "a2",
          "b1",
          "b2"
        ],
        "source_datasets": [
          "gse_all_objectives"
        ]
      },
      "lifecycle": {
        "first_exposure_level": "a1",
        "first_receptive_control_level": null,
        "first_productive_control_level": "a1",
        "consolidation_level": "a1",
        "recycle_levels": [
          "a2",
          "b1",
          "b2",
          "c1",
          "c2"
        ],
        "extension_levels": [
          "a2",
          "b1",
          "b2"
        ],
        "within_level_order_required": true,
        "stages": [
          {
            "level": "a1",
            "evidence_count": 4,
            "evidence_status": "source_evidenced",
            "control_expectation": "productive",
            "lifecycle_states": [
              "expose",
              "introduce",
              "practise",
              "consolidate"
            ]
          },
          {
            "level": "a2",
            "evidence_count": 4,
            "evidence_status": "source_evidenced",
            "control_expectation": "productive",
            "lifecycle_states": [
              "recycle",
              "extend"
            ]
          },
          {
            "level": "b1",
            "evidence_count": 1,
            "evidence_status": "source_evidenced",
            "control_expectation": "productive",
            "lifecycle_states": [
              "recycle",
              "extend"
            ]
          },
          {
            "level": "b2",
            "evidence_count": 1,
            "evidence_status": "source_evidenced",
            "control_expectation": "productive",
            "lifecycle_states": [
              "recycle",
              "extend"
            ]
          },
          {
            "level": "c1",
            "evidence_count": 0,
            "evidence_status": "planned_recycle",
            "control_expectation": "productive",
            "lifecycle_states": [
              "recycle"
            ]
          },
          {
            "level": "c2",
            "evidence_count": 0,
            "evidence_status": "planned_recycle",
            "control_expectation": "productive",
            "lifecycle_states": [
              "recycle"
            ]
          }
        ],
        "rationale": "Published level evidence sets the first control boundary; earlier Pre-A1 evidence remains support. The function is deliberately recycled at every later exit level, while extension is source-evidenced."
      },
      "review": {
        "status": "accepted",
        "review_basis": "source_level_boundary_plus_persistence_policy"
      }
    },
    {
      "strand_id": "function.clarify_or_repair",
      "function_code": "clarify_or_repair",
      "title": "Clarify Or Repair",